{
  "program_id": "11111111-1111-4111-8111-111111111111",
  "source_plan_id": "22222222-2222-4222-8222-222222222222",
  "source_plan_version": 1,
  "based_on_state_version": 3,
  "output_status": "proposal_only",
  "candidates": [
    {
      "candidate_id": "aaaaaaaa-aaaa-4aaa-8aaa-aaaaaaaaaaa1",
      "title": "Narrow the first milestone",
      "rationale": "Preserve evidence quality while reducing the amount of work attempted each week.",
      "changes": [
        {
          "task_ref": "44444444-4444-4444-8444-444444444444",
          "operation": "narrow_scope",
          "rationale": "Keep one evidence-bearing deliverable inside the weekly time cap."
        }
      ],
      "constraint_coverage": ["weekly-time-cap", "evidence-integrity"],
      "requires_human_review": true,
      "activates_plan": false
    },
    {
      "candidate_id": "aaaaaaaa-aaaa-4aaa-8aaa-aaaaaaaaaaa2",
      "title": "Defer the optional task",
      "rationale": "Retain the core deliverable and move optional work outside the current milestone.",
      "changes": [
        {
          "task_ref": "55555555-5555-4555-8555-555555555555",
          "operation": "defer",
          "rationale": "The optional task is not required for the current evidence target."
        }
      ],
      "constraint_coverage": ["weekly-time-cap", "evidence-integrity"],
      "requires_human_review": true,
      "activates_plan": false
    }
  ],
  "unresolved_constraints": [],
  "activation_allowed": false
}
